{
  "algorithm": "REVEALS",
  "parameters": {
    "basin_diameter_m": 300,
    "basin_type": "lake",
    "distance_weighting": "gpm neutral",
    "equation": "Sugita-2007-B1",
    "fall_speed_profile": "disqover-0.9.14-wrapper-v1",
    "iterations": 2,
    "paired_pollen_draws": false,
    "paired_ppe_draws": false,
    "region_cutoff_m": 100000.0,
    "retain_samples": true,
    "seed": 1201125462,
    "stochastic": false
  },
  "inputs": {
    "params": "95b1ec2124ddfcff1c2bdda562d8ad2ab650ed4c431f6d8a3bf8b87b1aab52d6",
    "pollen": "b1108ed898619f0453e22df4fa15de8b3b24f3da95d39bf67fdb68669a246538"
  },
  "stochastic": false,
  "seed": 1201125462,
  "compatibility_mode": "disqover-0.9.14",
  "package": "bijux-pollenomics-lra",
  "package_version": "0.1.9.dev1462",
  "reference_package": "disqover",
  "reference_version": "0.9.14",
  "reference_archive_sha256": "ea496ae82807b52c9dd3d4b39b4dfa294bfac4068e20184ce56187bff70caf5c",
  "schema_version": "1.0.0",
  "generated_at_utc": "2026-10-14T19:12:36.967443+00:00",
  "runtime": {
    "numerical_backend": "python-numpy-scipy",
    "numpy": "2.4.6",
    "pandas": "2.3.3",
    "platform": "macOS-26.6.2-arm64-arm-64bit",
    "python": "3.11.13",
    "scipy": "1.17.1"
  }
}
